id,category,question,answer,sources,source_pages,followups
what-should-be-on-a-simple-business-website,Marketing,What should be on a simple business website?,"Step 1: GOVERNOR’S SMALL BUSINESS HANDBOOK | 5 Creating a comprehensive business plan is an important process. The idea of writing a busi- ness plan may not seem important, however, it ultimately serves many important purposes. It will serve to outline the main purpose of your business, its structure, its financing, and its ad- vantages over other market competitors. A solid business plan can be used as a framework for your company’s mission and serves as support when it comes time to apply for financing. Here are some notes about what can be included in a Business…
Step 2: charter. Your attorney can also provide other necessary documentation. Remember, you must keep a corporation in good standing every year by submitting the required minimum documentation and fees. If not, your corporate shield can be stripped away, leaving you individually vulnerable. From a taxation standpoint, you need to con- sider several points regarding corporations. There are two corporate forms to consider: 1) C Corpora- tions and 2) S Corporations. The original corporation business form is a Corporation. A few of its characteristics are: • Its maximum tax rate is significantly lower than for an individual.
Step 3: name other than the name on file with the Secretary of State, must file an Assumed Name Certificate with the Secretary of State and each county in which the business will have a registered or principal office. As mentioned above, please note that neither the filing of an Assumed Name Certificate nor the reservation or registration of a company name imparts any real protection to the party filing the certificate. It is merely a formal process that informs the general public of the registered agent for a business and where official contact with the business…",Governor's Small Business Handbook|Texas Roadmap to Starting a Business,"5,34,15",Who is your target customer?|What channels will you try first?
how-do-i-set-up-google-business-profile-for-a-local-business,Marketing,How do I set up Google Business Profile for a local business?,"Step 1: GOVERNOR’S SMALL BUSINESS HANDBOOK | 45 with SCORE mentors to provide you with tailored assistance in a number of business areas. Score also offers more than 10,000 local business training workshops and seminars ranging in topic and scope depending on the needs of the local business community. For more information on The Score Association, see www.score.org or www.sba.gov/score. Austin SCORE 5524 Bee Caves Rd Westland Park Building M Suite 100 Austin, TX 78764 512-928-2425 Corpus Christi SCORE 2820 South Padre Island Dr Suite 108 Corpus Christi, TX 78415 361-879-0017 x 305 Dallas SCORE 5646 Milton…
Step 2: State State Sales Tax. Most products and many services are subject to sales tax. Each business must collect the tax and file a sales tax return on a regular basis. To obtain a sales tax permit and filing information, contact: Comptroller of Public Accounts LBJ State Office Building 111 East 17th Street Austin, Texas 78714 The comptroller also has offices in major cities Call 800/ 252-5555 for more information. State Franchise Tax. A state franchise tax applies to all corporations with representation in Texas. The tax is calculated based on taxable capital assets and taxable…
Step 3: • Identification of capital requirements needed and the general use of these funds. • Summary of potential financial results. Section III: Introduction The introduction should give a detailed descrip- tion of your product or service. The information you developed and refined during your feasibility study will be useful as you write this section. In the introduction bring up any distinctions or unique qualities of your product or service, such as a more convenient location or better service. Additionally, outline any proprietary positions that give you a competitive edge. These can be patents, copyrights or trademarks.",Governor's Small Business Handbook|Texas Roadmap to Starting a Business,"45,49,20",Who is your target customer?|What channels will you try first?
how-do-i-get-my-first-10-customers,Marketing,How do I get my first 10 customers?,"Step 1: different. A good example: Adults buy breakfast 10…
Step 2: regulations and state of the economy. You should also consider how your answers to the following questions could affect the price you establish. Does your firm lead pricing decisions or follow competitors? Are prices in your industry stable or erratic? How do your sales policies and terms compare to industry practices? For example, do you deliver? How do the features and benefits of your prod- ucts/services compare to those offered by your competitors? Can you reduce unit costs as unit volume increases, or are your costs fixed? Do your clients have to buy from you…
Step 3: the price as market share grows. Some products or services might be new to you or to a market but compete with similar items. You could use the similar product/service as a guide for setting your price, either adding or subtracting from theirs based on any differences in product/ service characteristics or functions. For identical products/services the price should be close to those of competitive products or ser- vices. The exception is if there is something special about your product that supports a higher price. Discounts Business owners often use discounts to induce customers to…",Texas Roadmap to Starting a Business,"11,23,25",Who is your target customer?|What channels will you try first?
how-do-i-create-a-referral-program,Marketing,How do I create a referral program?,"Step 1: development and provides business capital and commercial real estate loans throughout Texas. True to its mission to create jobs through business development, BCL of Texas has helped to create jobs for more than 5,000 Texans. In addition to providing businesses with counseling and technical assistance, BCL of Texas originates, underwrites, processes, closes and services business loans for healthy, growing businesses. BCL of Texas is a member of the nationwide NeighborWorks® Network, which engages in revitalization strategies that strengthen communities and transform lives. www.bcloftexas. org/ | FINANCING…
Step 2: GOVERNOR’S SMALL BUSINESS HANDBOOK | 47 referral network connecting returning veterans of Iraq and Afghanistan with the resources and tools they need to lead productive lives and enjoy the full benefits of the society they have willingly served. One Veterans Resource and Referral Specialist is assigned to each of the 28 workforce development areas, to work closely with Workforce Solutions office staff and Texas Veterans Commission staff who are co-located in Workforce Solutions offices. All 23 Veterans Resource and Referral Specialists are veterans of Iraq and/or Afghanistan. This network of returning veterans plays an integral…
Step 3: During your feasibility study you considered the various licenses and permits you may require to operate your business. The Texas Marketplace, Business Information and Referral Specialists at the Texas Department of Economic Development can assist you in obtaining the appropriate permits to operate within Texas. The State of Texas defines a permit as “any license, certificate, registration, permit or other form of authorization required by law or by state agency rules to be obtained by a person in order to engage in a particular business but does not include a permit or license issued in…",Governor's Small Business Handbook|Texas Roadmap to Starting a Business,"54,47,38",Who is your target customer?|What channels will you try first?
how-do-i-measure-whether-marketing-is-working,Marketing,How do I measure whether marketing is working?,"Step 1: as basic 7(a), but when borrower has both international trade and working capital loans, guaranteed by the SBA, the limit to any one business can be $4 million. Same as basic 7(a). Same as basic 7(a). Plus, long-term financing for export related fixed assets and working capital. The following programs are intended to serve as an example for the types of programs offered by the SBA at any given time. Please check with your local SBDC for the availability of these funds. | FEDERAL PROGRAMS…
Step 2: reputation of another. If a federal registration has been issued by the United States Patent and Trademark Office, the letter R enclosed-within-a-circle should appear as a superscript adjacent to the mark to obtain the full measure of federal protection. It is possible to register a mark under the trademark laws of each of the 50 states. However, state registration alone does not confer the right to use the R-within-a-circle symbol. The superscripts TM and SM serves as a warning to others that the user considers the mark to be exclusively his or hers. 35…
Step 3: three working days after the employee begins work. Additionally, if you cannot obtain all the necessary documenta- tion on the hire date, it must be submitted within 41…",Governor's Small Business Handbook|Texas Roadmap to Starting a Business,"80,36,42",Who is your target customer?|What channels will you try first?
how-do-i-write-a-simple-elevator-pitch,Marketing,How do I write a simple elevator pitch?,"Step 1: charter. Your attorney can also provide other necessary documentation. Remember, you must keep a corporation in good standing every year by submitting the required minimum documentation and fees. If not, your corporate shield can be stripped away, leaving you individually vulnerable. From a taxation standpoint, you need to con- sider several points regarding corporations. There are two corporate forms to consider: 1) C Corpora- tions and 2) S Corporations. The original corporation business form is a Corporation. A few of its characteristics are: • Its maximum tax rate is significantly lower than for an individual.
Step 2: used here refers to actual currency or money in your bank account on which you can write a check. It does not include accounts receiv- able (products or services sold, but unpaid). Your first task is to identify all your sources of cash. For a start-up business, this usually includes sales, the owners’ investment (equity), bank loans and loans from owners or lenders. For existing businesses, funding sources may also include collection of accounts receivable, sales of assets and refunds from suppliers or vendors. Completing the Form Find line 1 under Pre-Start-Up and enter any…
Step 3: GOVERNOR’S SMALL BUSINESS HANDBOOK | 107 Food Manufacturing and Distribution Alcohol Licenses: Texas Alcoholic Beverage Commission Boiler Certification: Texas Department of Licensing and Regulation Butane Regulations: Texas Railroad Commission Egg Broker/Dealer/Processor License, Meat Products Processing Regulations, Organic Food and Fiber Regulations, Pesticide Licenses, Weighing/Measuring Device Permits: Texas Department of Agriculture Environmental Regulations: Texas Department on Environmental Quality Feed/Fertilizer Regulations: Office of the Texas State Chemist Fire Regulations: Local Fire Marshal Fish/Seafood Products Processing License: Texas Parks and Wildlife Service Food Manufacturer’s License, Milk Licenses, Rendering Licenses, Salvage Food Licenses, Shellfish and Crab meat Processing Licenses:…",Texas Roadmap to Starting a Business|Governor's Small Business Handbook,"34,29,107",Who is your target customer?|What channels will you try first?
how-do-i-create-an-offer-customers-say-yes-to,Marketing,How do I create an offer customers say yes to?,"Step 1: development and provides business capital and commercial real estate loans throughout Texas. True to its mission to create jobs through business development, BCL of Texas has helped to create jobs for more than 5,000 Texans. In addition to providing businesses with counseling and technical assistance, BCL of Texas originates, underwrites, processes, closes and services business loans for healthy, growing businesses. BCL of Texas is a member of the nationwide NeighborWorks® Network, which engages in revitalization strategies that strengthen communities and transform lives. www.bcloftexas. org/ | FINANCING…
Step 2: business, such as experience, time, and legal and funding issues. A feasibility study can take weeks or even months to complete, but the process puts you at an advantage and increases your chances for success. If you move forward and start your business, the feasibility study will serve as the basis from which to develop a comprehensive business plan. If you decide to put your venture plans on hold, you can apply the knowledge to other possible ventures, or it could prompt you to adjust or re-evaluate your original idea. Your Idea: Defining Your Business…
Step 3: business to be successful. That is, you must offer the right product or service at the right price using the right promotional efforts at the right place and time. Price. To pinpoint the right price, you need a combination of experience, market knowledge and good judgment. Study your competitors’ pricing and estimate your costs. Can you price your product or service competitively and still cover costs? Consider the following factors to determine the best price for your product or service. Are prices in your industry stable or do they fluctuate? Must your clients buy from…",Governor's Small Business Handbook|Texas Roadmap to Starting a Business,"54,4,13",Who is your target customer?|What channels will you try first?
how-do-i-handle-discounts-without-hurting-my-margins,Marketing,How do I handle discounts without hurting my margins?,"Step 1: must decide to either allow the discount or ask the customer for full payment. Volume Discounts. Volume discounts are based on the unit quantity purchased and are offered to encourage larger purchases. For example, a tire supplier may choose to sell two tires at $50 each or four tires at $40 each. Volume discounts can be offered as a normal business practice or for limited periods. 24…
Step 2: the price as market share grows. Some products or services might be new to you or to a market but compete with similar items. You could use the similar product/service as a guide for setting your price, either adding or subtracting from theirs based on any differences in product/ service characteristics or functions. For identical products/services the price should be close to those of competitive products or ser- vices. The exception is if there is something special about your product that supports a higher price. Discounts Business owners often use discounts to induce customers to…
Step 3: Volume discounts have several advantages. First, large orders can reduce associated marketing costs for selling, shipping, packaging and delivery. These costs can then be passed on or shared with the customer. Second, if a seller offers a range of products, discounts on the entire range can encour- age sale and turnover of less popular products. Third, special discounts can reduce stocks of slow moving, low turnover inventory. Fourth, sellers may take advantage of the discount and purchase larger quantities. Volume discounts can present problems, which can be remedied with advance planning. For instance, customers may…",Texas Roadmap to Starting a Business,"25,26",Who is your target customer?|What channels will you try first?
what-should-i-post-on-social-media-for-a-new-business,Marketing,What should I post on social media for a new business?,"Step 1: 4 | GOVERNOR’S SMALL BUSINESS HANDBOOK Small businesses are an important part of the state’s mission in helping keep Texas a very business-friendly, fair, dynamic and flourishing economy — one of the best, healthiest and fastest-growing in the country. Small businesses are the backbone of our state and nation, and through collaborations with organizations like yours we help ensure that they remain a top priority and focal point of the public and private sector. We hope that this handbook will provide a resourceful foundation, inspire new ideas and expanded connections, and encourage the inception, growth…
Step 2: GOVERNOR’S SMALL BUSINESS HANDBOOK | 29 www.TexasWideOpenForBusiness.com | @TexasOne /TexasWideOpen /texas-wide-open Technology driven economic development is something that Texas is well known for. The capital, Austin, has been nicknamed the “Silicon Hills”. Companies like Texas Instruments, Dell and IBM have called Texas home for decades while newcomers like Apple, Facebook, and Rackspace have recently built establishments in the Lone Star State. But, even outside of the larger companies, Texas has a diverse community of startups in gaming, social media, biotech, site hosting, and many more. Technology-focused small businesses were concentrated in the following industries in…
Step 3: conditions could affect your business: Social or lifestyle changes Economic changes Political and/or legal changes Technological changes Population (demographic) changes Any other change in the business environment Conducting Your Research You can gather your information from existing data (secondary sources) or from new data (primary research). To access secondary sources, start at your local library. Many public and private organizations collect and publish data on population and indus- tries, which is often available at public or college libraries. For example, trade associations maintain industry statistics and projections. Federal, state, county and city governments also gather…",Governor's Small Business Handbook|Texas Roadmap to Starting a Business,"4,29,5",Who is your target customer?|What channels will you try first?
how-do-i-build-an-email-list-and-what-should-i-send,Marketing,How do I build an email list and what should I send?,"Step 1: Provide a stated goal for when the company will be profitable and what the return on the investment will be. Development and regulatory process outline: Provide a time frame demonstrating the time it will take to build, produce, and generate the business. Include breakdown of any risk and explain why and how that will be overcome. PREPARATION: Writing a Business Plan INTRODUCTION |…
Step 2: GOVERNOR’S SMALL BUSINESS HANDBOOK | 37 RESOURCE: Texas Workforce Commission Texas Workforce Solutions is comprised of the Texas Workforce Commission (TWC) partnered with 28 local workforce development boards. The TWC was created in 1996 to consolidate 28 programs from 10 agencies and is tasked to strengthen the Texas workforce, provide support services and administer unemployment benefits and tax programs. TWC and Workforce Solutions provide integrated services for employers and job seekers. More information on these programs is available at www.twc.state.tx.us. Skills for Small Business Provides training funds to for-profit businesses with fewer than 100 employees…
Step 3: GOVERNOR’S SMALL BUSINESS HANDBOOK | 91 Benefits HUB certification is free of charge. Certification is valid for 4 years, provided that business continues to meet the eligibility requirements.* Business is registered on the Texas Comptroller’s Web-based HUB Directory. State agencies use the HUB Directory in conjunction with the Texas Comptroller’s Centralized Master Bidders List (CMBL) to solicit bids from certified HUBs for state purchasing and public works contracts. Prime contractors also use the HUB Directory to identify HUBs to whom they will send notification of their subcontracting opportunities. Increased exposure to the general public, as…",Governor's Small Business Handbook,"5,37,91",Who is your target customer?|What channels will you try first?
how-do-i-build-credibility-quickly-reviews-case-studies,Marketing,"How do I build credibility quickly (reviews, case studies)?","Step 1: Service Encyclopedia of Trade Associations Financial Studies of the Small Business 7…
Step 2: Provide a stated goal for when the company will be profitable and what the return on the investment will be. Development and regulatory process outline: Provide a time frame demonstrating the time it will take to build, produce, and generate the business. Include breakdown of any risk and explain why and how that will be overcome. PREPARATION: Writing a Business Plan INTRODUCTION |…
Step 3: you need. Assets such as cash, ac- counts receivable, and inventory should be fi- nanced with short term debt. Assets such as equip- ment, vehicles, and real estate should be financed with long term debt. A term note is most often 1 to 7 years of length and requires monthly payments of principle and interest. Financing cash and inventory with long term debt increases your interest expense, and financing high dollar amount equipment on a line of credit makes your monthly payments of principle and interest very large. To give a logical reason for making…",Texas Roadmap to Starting a Business|Governor's Small Business Handbook,"8,5,45",Who is your target customer?|What channels will you try first?
how-do-i-create-a-simple-sales-process-for-a-service-business,Sales,How do I create a simple sales process for a service business?,"Step 1: name other than the name on file with the Secretary of State, must file an Assumed Name Certificate with the Secretary of State and each county in which the business will have a registered or principal office. As mentioned above, please note that neither the filing of an Assumed Name Certificate nor the reservation or registration of a company name imparts any real protection to the party filing the certificate. It is merely a formal process that informs the general public of the registered agent for a business and where official contact with the business…
Step 2: GOVERNOR’S SMALL BUSINESS HANDBOOK | 5 Creating a comprehensive business plan is an important process. The idea of writing a busi- ness plan may not seem important, however, it ultimately serves many important purposes. It will serve to outline the main purpose of your business, its structure, its financing, and its ad- vantages over other market competitors. A solid business plan can be used as a framework for your company’s mission and serves as support when it comes time to apply for financing. Here are some notes about what can be included in a Business…
Step 3: development and provides business capital and commercial real estate loans throughout Texas. True to its mission to create jobs through business development, BCL of Texas has helped to create jobs for more than 5,000 Texans. In addition to providing businesses with counseling and technical assistance, BCL of Texas originates, underwrites, processes, closes and services business loans for healthy, growing businesses. BCL of Texas is a member of the nationwide NeighborWorks® Network, which engages in revitalization strategies that strengthen communities and transform lives. www.bcloftexas. org/ | FINANCING…",Governor's Small Business Handbook,"15,5,54",Are you selling services or products?|Do you do consultations or quotes?
how-do-i-qualify-leads-so-i-don-t-waste-time,Sales,How do I qualify leads so I don’t waste time?,"Step 1: but it is much better to learn this now before you spend additional money and time on an idea that won’t be profitable for you. Time to reevaluate. Your analysis might show that your idea is not feasible, but only temporarily. Perhaps you don’t qualify for a needed license, but you could get the permit with additional special- ized training. Be careful when you reevaluate. It’s your money at risk. If the projected financial picture looks bleak, the real one won’t be any better. Successful business people know when to walk away. Look for other…
Step 2: Reform Requirements Small businesses with fewer than 50 full-time plus full-time equivalent employees won’t face a penalty if they don’t provide health insurance to their employees. Federal law defines a full-time employee as one who works at least 30 hours during a typical work week. The law counts each 120 hours worked by part-time employees in a month as one full-time equivalent employee.
Step 3: 34 | GOVERNOR’S SMALL BUSINESS HANDBOOK | INSURANCE Employers aren’t required to contribute toward their premiums for former employees, even if they previously paid a share. Ask your carrier about your responsibilities regarding continuation notices. Paying for Coverage The law doesn’t require employers to contribute toward health benefit plan premiums. Many insurance companies, however, require employers to pay at least 50 percent of their employees’ plan premiums. Employers may choose to pay a higher percentage than the company requires. Employers are usually not required to contribute toward the cost of dependent coverage. Premiums may increase…",Texas Roadmap to Starting a Business|Governor's Small Business Handbook,"17,34",Are you selling services or products?|Do you do consultations or quotes?
