id,category,question,answer,sources,source_pages,followups
tx-llc-formation-form205,Formation,How do I properly set up an LLC in Texas?,"Step 1: Choose a unique business name (including an LLC designator) and check availability.
Step 2: File a Certificate of Formation – Limited Liability Company (Form 205) with the Texas Secretary of State (SOS).
Step 3: Designate a registered agent and registered office in Texas.
Step 4: Draft a Company/Operating Agreement to govern internal affairs (strongly recommended).
Step 5: Maintain statutory records and meet ongoing obligations such as Texas franchise tax filings.",https://www.sos.state.tx.us/corp/forms/205_boc.pdf?utm_source=chatgpt.com|https://www.sos.state.tx.us/corp/businessstructure.shtml?utm_source=chatgpt.com,,Single-member or multi-member LLC?|What city will you operate in?|Will you have employees?
what-is-a-feasibility-study-and-why-should-i-do-one-before-s,Planning,What is a feasibility study and why should I do one before starting a business?,"Step 1: The Feasibility Study The Business Plan Cash Flow Requirements Legal Issues Permits Employee & Contract Labor Financing Options Tax Responsibilities Texas Roadmap to Starting a Business Chapter 1: The Feasibility Study Chapter 1: The Feasibility Study The…
Step 2: This first step helps you, the prospective business owner, determine the practi- cality and viability of your business idea.
Step 3: After completing the feasibility study, you will have an indication of market opportunity and growth potential.
Step 4: You want this information now, before you risk valuable time and money.
Step 5: The feasibility study can help you analyze the possible risks and rewards of your concept and increase the probability of your success.",Texas Roadmap to Starting a Business (SBDC),"1,3,27",What type of business are you considering?|Do you already have customers or just an idea?
what-should-be-included-in-a-strong-business-plan,Planning,What should be included in a strong business plan?,"Step 1: Fifth, don’t be discouraged if you meet unex- pected obstacles.
Step 2: In fact, obstacles are the one thing to count on.
Step 3: Put yourself and your business at an advantage by anticipating and planning for diver- sions.
Step 4: When outsiders like prospective bankers and private investors read your plan, they consider your aptitude as a small business owner.
Step 5: You will earn credibility by candidly identifying obstacles and your strategies for overcoming them.",Texas Roadmap to Starting a Business (SBDC)|Governor’s Small Business Handbook,"19,28,5",Who is your target customer?|Are you seeking funding (loan/investors)?
how-should-i-think-about-cash-flow-requirements-for-a-new-bu,Finance,How should I think about cash flow requirements for a new business?,"Step 1: The Feasibility Study The Business Plan Cash Flow Requirements Legal Issues Permits Employee & Contract Labor Financing Options Tax Responsibilities Texas Roadmap to Starting a Business currency or money in your bank account on which you can write a check.
Step 2: It does not include accounts receiv- able (products or services sold, but unpaid).
Step 3: Your first task is to identify all your sources of cash.
Step 4: For a start-up business, this usually includes sales, the owners’ investment (equity), bank loans and loans from owners or lenders.
Step 5: For existing businesses, funding sources may also include collection of accounts receivable, sales of assets and refunds from suppliers or vendors.",Texas Roadmap to Starting a Business (SBDC),"1,29",Do you have a monthly revenue estimate?|What are your biggest startup costs?
what-are-the-main-steps-to-start-a-business-in-texas,Formation,What are the main steps to start a business in Texas?,"Step 1: How to Start a Business in Texas INTRODUCTION | GOVERNOR’S SMALL BUSINESS HANDBOOK | 7 In business, there are no guarantees.
Step 2: There is simply no way to eliminate all the risks associated with starting a small business but you can improve your chances of success with good planning, preparation, and insight.
Step 3: In Texas, small businesses continue to thrive due to a variety of factors including our excellent geographic location, our highly skilled workforce, our low tax burden, our reasonable cost of living, our predictable regulatory environment, and our legacy of…
Step 4: Starting a business in Texas requires you to complete a number of basic steps and make some key decisions.
Step 5: As part of your overall plan, you’ll need to select a location, decide on a business structure, obtain the necessary licenses and permits, and determine which financing options will meet your needs and goals.",Governor’s Small Business Handbook|Texas Roadmap to Starting a Business (SBDC),"7,2","What business structure are you considering (LLC, sole prop, corporation)?|Will you have employees?"
how-do-i-figure-out-what-licenses-and-permits-my-business-ne,Licenses & Permits,How do I figure out what licenses and permits my business needs in Texas?,Step 1: | BUSINESS LICENSES AND PERMITS Tax Permits: Texas Comptroller of Public Accounts | BUSINESS LICENSES AND PERMITS Comptroller of Public Accounts | BUSINESS LICENSES AND PERMITS,Governor’s Small Business Handbook,"116,98,114","What city/county will you operate in?|What industry are you in (food, services, retail)?"
what-s-the-difference-between-hiring-employees-vs-using-cont,Hiring,What’s the difference between hiring employees vs using contract labor?,"Step 1: The Feasibility Study The Business Plan Cash Flow Requirements Legal Issues Permits Employee & Contract Labor Financing Options Tax Responsibilities Texas Roadmap to Starting a Business When your business begins to grow, you may need to expand your staff.
Step 2: Your first questions will be: Do you hire full- or part-time employees or do you hire subcontractors to perform specific projects on an as- needed basis?
Step 3: Contract labor requires less paperwork, but keep in mind, there are important distinctions between contract labor and employees.
Step 4: If you incorrectly classify your workers, you may end up paying some big dollars to the IRS and the Texas Workforce Commission (TWC).
Step 5: Employee/employer relations typically display one or more of these traits: • Job training is necessary • Employer holds supervision and payroll responsibilities • Employer sets work hours • Workplace is restricted (that is, employee must work on site) •…",Texas Roadmap to Starting a Business (SBDC),"1,41,42",Will you control the worker’s schedule and tools?|Is the role ongoing or project-based?
what-financing-options-should-a-small-business-consider,Finance,What financing options should a small business consider?,"Step 1: The Feasibility Study The Business Plan Cash Flow Requirements Legal Issues Permits Employee & Contract Labor Financing Options Tax Responsibilities Texas Roadmap to Starting a Business historical information to consider.) Other areas can influence capacity…
Step 2: These factors give credence or add skepti- cism to the projection viability.
Step 3: As defined by Webster’s, it is “property pledged by a borrower to protect the interests of the lender.” This covers the gamut from your business’ operational assets (such as accounts receivable, inventory and equipment) Chapter 7: Financing Options 43 - 2617…",Texas Roadmap to Starting a Business (SBDC)|Governor’s Small Business Handbook,"1,44,59",How much funding do you need?|Do you have revenue yet?
what-tax-responsibilities-should-a-new-texas-business-plan-f,Taxes,What tax responsibilities should a new Texas business plan for?,"Step 1: The Feasibility Study The Business Plan Cash Flow Requirements Legal Issues Permits Employee & Contract Labor Financing Options Tax Responsibilities Texas Roadmap to Starting a Business GOVERNOR’S SMALL BUSINESS HANDBOOK | 7 In business, there are no…
Step 2: There is simply no way to eliminate all the risks associated with starting a small business but you can improve your chances of success with good planning, preparation, and insight.
Step 3: In Texas, small businesses continue to thrive due to a variety of factors including our excellent geographic location, our highly skilled workforce, our low tax burden, our reasonable cost of living, our predictable regulatory environment, and our legacy of…
Step 4: Starting a business in Texas requires you to complete a number of basic steps and make some key decisions.
Step 5: As part of your overall plan, you’ll need to select a location, decide on a business structure, obtain the necessary licenses and permits, and determine which financing options will meet your needs and goals.",Texas Roadmap to Starting a Business (SBDC)|Governor’s Small Business Handbook,"1,7,48",Are you selling products (sales tax)?|Will you have employees (payroll taxes)?
what-is-a-texas-llc-and-how-does-it-work,Formation,What is a Texas LLC and how does it work?,"Step 1: flexibility than more traditional business entities.
Step 2: The owners of an LLC are called “members.” An LLC may have one or more members.
Step 3: A member can be an individual, partnership, trust, and any other legal entity.
Step 4: Unlike the partnership, where the key element is the individual, the essence of an LLC is the entity, which requires more formal requirements in terms of registration.
Step 5: The limited liability company is designed to provide its owners with limited liability STEP ONE | 1 A limited partnership is governed by title 4, chapters 151 and 153 of the Texas Business Organizations Code.",Governor’s Small Business Handbook|Texas Roadmap to Starting a Business (SBDC),"11,12,35",Is this single-member or multi-member?|Are you considering an S-corp election?
do-i-need-a-registered-agent-in-texas,Compliance,Do I need a registered agent in Texas?,"Step 1: The Texas Business Organizations Code (“BOC”) requires every domestic or foreign filing entity (business) to maintain a registered agent and office in Texas.
Step 2: A registered agent is an agent of the entity on whom may be served any process, notice, or demand required or permitted by law to be served on the entity.
Step 3: STEP ONE | after mailing by the Secretary of State, and has not yet been involuntarily terminated.
Step 4: RA Notice Sent: an active status indicating that the registered agent of the entity has resigned and a new registered agent has not been designated or that an allegation has been made that the entity is not maintaining a registered agent.
Step 5: Notice of the need to appoint a new registered agent has been mailed by the Secretary of State.",Governor’s Small Business Handbook,"13,18,16",Will you use a registered agent service?|Do you have a Texas physical address?
what-should-i-do-first-when-starting-a-business-in-texas,Start Here,What should I do first when starting a business in Texas?,"Step 1: your 26 relating to employment of personnel.
Step 2: How to Start a Business in Texas INTRODUCTION | Financial Studies of the Small Business 7",Texas Roadmap to Starting a Business (SBDC)|Governor’s Small Business Handbook,"27,7,8",Is this a new business or expansion?|What industry are you in?
how-do-i-choose-the-right-business-structure-for-my-company,Formation,How do I choose the right business structure for my company?,"Step 1: 8 | GOVERNOR’S SMALL BUSINESS HANDBOOK SELECTING A BUSINESS ENTITY FORMATION AND REGISTERING WITH THE TEXAS SECRETARY OF STATE (if necessary): Determining which business structure is right for a business is an important decision.
Step 2: The information in this section provides an overview of the most commonly utilized for-profit business structures.
Step 3: (Disclaimer: For the most current and accurate information on business entity formations, contact the Texas Secretary of State).
Step 4: SOLE PROPRIETORSHIP: A sole proprietorship is the most common and simplest form of business structure.
Step 5: A sole proprietorship exists when a single individual who owns all of the business’s assets engages in business activity without the necessity of having to have a formal organization.",Governor’s Small Business Handbook,"8,7,5",Are you planning to raise capital?|Do you want liability protection?
what-ongoing-compliance-should-i-expect-after-forming-a-busi,Compliance,What ongoing compliance should I expect after forming a business?,"Step 1: 12 | GOVERNOR’S SMALL BUSINESS HANDBOOK and pass-through tax advantages without the restrictions imposed on Subchapter S Corporations and limited partnerships.
Step 2: Generally, the liability of the members is limited to their investment and they may enjoy the pass-through tax treatment afforded to partners in a partnership.
Step 3: As a result of federal tax classification rules, and LLC can achieve both structural flexibility and favorable tax treatment.
Step 4: Nevertheless, persons contemplating forming an LLC should consult with an attorney as to whether this structure is suitable for their business needs.1 LLCs are subject to state franchise tax.
Step 5: Filing fee for a certification of formation for an LLC is $300 1 An LLC is governed by title 3, chapter 101 of the Texas Business Organizations Code.",Governor’s Small Business Handbook|Texas Roadmap to Starting a Business (SBDC),"12,22,31",Are you an LLC or corporation?|Will you operate only in Texas?
what-records-should-i-keep-to-stay-organized-and-compliant,Operations,What records should I keep to stay organized and compliant?,"Step 1: 16 | GOVERNOR’S SMALL BUSINESS HANDBOOK If the county you are seeking to register in does not provide this service, and if you have to personally research in order to find out if a name already exists in a particular county, search the county records for that…
Step 2: An assumed name filing is valid for ten years, so search records for the last ten years to verify that the name is available.
Step 3: One book will not necessarily encompass one year of filings, so check the front of the book for dates.
Step 4: Some records are computerized; however, a computerized index may not contain ten years of filing history.
Step 5: Use the computer for the period it covers, and then use the books for any of the remaining ten years.",Governor’s Small Business Handbook,"16,26,20",Do you have partners/members?|Do you have contracts/invoices to track?
tx-name-availability,Formation,How do I check if my LLC name is available in Texas?,"Step 1: Brainstorm a few name options that include an LLC designator (like “LLC” or “L.L.C.”).
Step 2: Check Texas Secretary of State name availability resources (and consider reserving a name if needed).
Step 3: Avoid names that are deceptively similar or require special approvals.
Step 4: If you’ll use a different public-facing brand name, plan for an assumed name (DBA) filing.",https://www.sos.state.tx.us/corp/namefilingsfaqs.shtml|https://www.sos.state.tx.us/corp/forms_boc.shtml,,What name(s) are you considering?|Will you use a DBA/brand name different from the legal name?
tx-form-205-fee,Formation,How much does it cost to file a Texas LLC (Form 205) and where do I file it?,"Step 1: Prepare the Certificate of Formation – LLC (Form 205).
Step 2: File with the Texas Secretary of State (often via SOSDirect, or by other accepted methods).
Step 3: Pay the state filing fee (Form 205 lists a $300 filing fee).
Step 4: Keep your stamped/approved copies in your company records.",https://www.sos.state.tx.us/corp/forms/205_boc.pdf|https://www.sos.state.tx.us/corp/forms_boc.shtml,,Are you filing online (SOSDirect) or by mail?|Do you want a single-member or multi-member LLC?
tx-ein,Taxes,Does my Texas LLC need an EIN and how do I get one?,"Step 1: Many LLCs need an EIN (especially if you have employees, multiple members, or want to open certain bank accounts).
Step 2: Apply directly on the IRS website (it’s free).
Step 3: Save the EIN confirmation for banking and tax registrations.
Step 4: Watch out for third-party sites that charge fees for an EIN.",https://www.irs.gov/businesses/small-businesses-self-employed/get-an-employer-identification-number|https://www.irs.gov/forms-pubs/about-form-ss-4,,Will you have employees?|Is your LLC single-member or multi-member?
tx-franchise-tax-basics,Taxes,What is the Texas franchise tax and when is it due?,"Step 1: Assume your LLC will have Texas franchise tax obligations unless an exemption applies.
Step 2: Plan for an annual filing cycle.
Step 3: The Texas Comptroller’s guidance says the annual franchise tax report is due May 15 (or the next business day if it falls on a weekend/holiday).
Step 4: Keep your entity info and ownership details current to file accurately.",https://comptroller.texas.gov/taxes/franchise/|https://comptroller.texas.gov/taxes/publications/98-806.php,,Do you expect revenue under the no-tax-due threshold?|What is your accounting year end?
tx-sales-tax-permit,Taxes,Do I need a Texas sales tax permit and how do I apply?,"Step 1: If you sell, lease, or rent taxable goods/services (or owe use tax), you likely need a Texas sales tax permit.
Step 2: Apply through the Texas Comptroller (online registration system or paper application).
Step 3: After approval, collect and remit sales tax as required.
Step 4: Keep up with reporting and payment requirements for your permit.",https://comptroller.texas.gov/help/sales-tax-registration/requirements.php/|https://comptroller.texas.gov/taxes/permit/|https://comptroller.texas.gov/taxes/sales/faq/permit.php,,"What are you selling (goods/services)?|Will you sell online, in-person, or both?"
tx-dba-assumed-name,Compliance,Do I need a DBA (assumed name) in Texas for my business?,"Step 1: If you will operate under a name that’s different from your LLC’s legal name, you may need an assumed name (DBA) filing.
Step 2: Texas SOS provides assumed name filing information and Form 503.
Step 3: Depending on your setup, you may also need to file at the county level where you conduct business.
Step 4: Track renewal/validity periods and keep copies in your records.",https://www.sos.state.tx.us/corp/namefilingsfaqs.shtml|https://www.sos.state.tx.us/corp/forms/503_boc.pdf,,Is your brand name different from your legal LLC name?|Which county/city will you operate in?
tx-unemployment-tax-registration,Hiring,"If I hire employees, what do I need to do for Texas unemployment tax?","Step 1: Determine when you become a liable employer under Texas rules.
Step 2: Register for a Texas Workforce Commission (TWC) unemployment tax account.
Step 3: TWC guidance says employers must register within 10 days of becoming liable.
Step 4: File wage reports and pay unemployment tax as required.",https://www.twc.texas.gov/services/register-tax|https://www.twc.texas.gov/programs/unemployment-tax,,How many employees do you expect in the first 90 days?|Are you paying W-2 wages or using contractors?
tx-new-hire-reporting,Hiring,Do I have to report new hires in Texas and what is the deadline?,"Step 1: If you hire employees, you’ll generally need to report new hires and rehires.
Step 2: Texas guidance states employers must report new hires/rehires within 20 calendar days of the hire date.
Step 3: Set a process: once a worker completes a W-4, file the new hire report.
Step 4: Keep proof of submission for your records.",https://www.twc.texas.gov/employer-resources/new-hire-reporting|https://www.texasattorneygeneral.gov/child-support/employers/new-hire-reporting,,How many hires are you planning soon?|Are any hires remote/out-of-state?
tx-boi-cta-status,Compliance,Do I need to file a Beneficial Ownership Information (BOI) report for my Texas LLC?,"Step 1: BOI requirements have changed recently and depend on whether the entity is a U.S. company or a foreign company registered to do business in the U.S.
Step 2: FinCEN’s BOI page notes an interim final rule that removes the BOI reporting requirement for U.S. companies and U.S. persons (while foreign companies may still have obligations).
Step 3: Verify your status directly on FinCEN before you assume you’re exempt.
Step 4: If you’re unsure, confirm with counsel because this area is evolving.",https://www.fincen.gov/boi|https://www.sos.state.tx.us/corp/cta.shtml,,Is your entity formed in the U.S. or outside the U.S.?|Are you registering a foreign entity in Texas?
tx-sosdirect-what-is,Formation,What is SOSDirect and when should I use it to form a Texas business?,"Step 1: Use SOSDirect to search and file Texas business documents online with the Secretary of State.
Step 2: It’s commonly used for formation filings, assumed name filings, and ordering records/certificates.
Step 3: Expect small per-search fees; save receipts and confirmations.
Step 4: For faster processing, review SOS filing options and expedited services.",https://www.sos.state.tx.us/corp/sosda/index.shtml|https://www.sos.state.tx.us/corp/options.shtml,,Are you filing online or by mail?|Do you need expedited processing?
tx-assumed-name-duration,Compliance,How long is an assumed name (DBA) valid in Texas when filed with the Secretary of State?,"Step 1: Form 503 allows an assumed name period up to 10 years.
Step 2: Pick a duration and track the expiration date.
Step 3: Keep filed copies with your records.
Step 4: Renew/replace before expiration if you still use the name.",https://www.sos.state.tx.us/corp/forms/503_boc.pdf|https://www.sos.state.tx.us/corp/instructions/503.shtml,,Is your brand name different from the LLC name?|Which counties will you operate in?
tx-management-structure,Formation,Do I need to choose member-managed or manager-managed for a Texas LLC?,"Step 1: Texas LLCs can be managed by members or by managers.
Step 2: The management structure must be stated in the certificate of formation.
Step 3: Member-managed fits owner-operated businesses; manager-managed fits a delegated management setup.
Step 4: Mirror this in your operating agreement and internal records.",https://www.sos.state.tx.us/corp/businessstructure.shtml|https://www.sos.state.tx.us/corp/forms/205_boc.pdf,,Will owners run day-to-day operations?|Will there be passive members?
tx-i9-basics,Hiring,"If I hire employees, do I have to complete Form I-9 and what’s the deadline?","Step 1: Employers must complete and retain Form I-9 for each person hired for employment in the U.S.
Step 2: Employees complete Section 1 no later than the first day of employment.
Step 3: Employers complete Section 2 within 3 business days of the employee’s first day of work.
Step 4: Follow USCIS guidance for verification and retention.",https://www.uscis.gov/i-9-central/completing-form-i-9|https://www.uscis.gov/i-9-central/completing-form-i-9/completing-section-2-employer-review-and-attestation,,How soon are you hiring?|Are any hires remote?
how-do-i-validate-my-business-idea-quickly,Start Here,How do I validate my business idea quickly?,"Step 1: in mind, let’s get started. Section I: Table of Contents A table of contents is essential if you intend to use your business plan to seek financing. Each investor or banker will read the text from the perspective of their background and experience. Number the pages of your business plan and include a table of contents to make it easier for readers to find what interests them. This will increase the chance that they will read your plan. Section II: Executive Summary The Executive Summary should capture the reader’s attention and entice them to read…
Step 2: Chapter 1: The Feasibility Study Chapter 1: The Feasibility Study The first step on your road to starting a business is the feasibility study. This first step helps you, the prospective business owner, determine the practi- cality and viability of your business idea. After completing the feasibility study, you will have an indication of market opportunity and growth potential. You want this information now, before you risk valuable time and money. The feasibility study can help you analyze the possible risks and rewards of your concept and increase the probability of your success. During this…
Step 3: • establishes work hours • also works for others • has own trade or business name • is responsible for paying taxes resulting from compensation. Besides these rules, answering this question should help you distinguish a contract laborer: Does an employee within the company perform the same job? If the answer is yes, then the worker is most likely an employee. It is irrelevant that someone only works part-time or that the job only lasts for a specific period (such as six weeks). For example, if a female employee is on maternity leave and someone…",Texas Roadmap to Starting a Business,"19,3,42","What type of business are you starting?|Is it local, online, or both?"
